{
  "specVersion": "1",
  "id": "reasoning-framework",
  "version": "0.3.0",
  "name": "Reasoning Framework",
  "description": "Use when stress-testing a conclusion, auditing a complex claim, mapping a multi-actor system, or spotting motivated reasoning in a single recursive pass — when rigor matters more than speed. Skip for time-pressured decisions, mechanical tasks, lookups, or when the user wants a recommendation rather than a tour of considerations. For a decision with genuine multi-stakeholder stakes spanning several teams, or organization-scale, hard-to-reverse consequences, use reasoning-swarm instead — its independent-parallel-agent dispatch is worth the extra cost there.",
  "tags": ["reasoning", "analysis", "critical-thinking", "epistemics"],
  "body": { "path": "body.md" },
  "targets": {
    "claude-skill": { "enabled": true },
    "claude-plugin": { "enabled": true, "category": "reasoning" },
    "openai-gpt": {
      "enabled": true,
      "conversationStarters": [
        "Stress-test this argument: …",
        "Map the system around …",
        "What would force me to abandon this conclusion?",
        "What does this question presuppose?"
      ]
    },
    "portable": { "enabled": true }
  }
}
