{
  "specVersion": "1",
  "id": "e2e-demo",
  "version": "0.0.1",
  "name": "E2e Demo",
  "description": "Use when verifying that skillsmith new and build wire up end-to-end.",
  "body": {
    "path": "body.md"
  },
  "targets": {
    "claude-skill": {
      "enabled": true
    },
    "claude-plugin": {
      "enabled": true
    },
    "openai-gpt": {
      "enabled": false
    },
    "portable": {
      "enabled": true
    }
  }
}
